{"schemaVersion":1,"datasetId":"bong-1000-v1","sourceSha256":"d47f279eb2cce77a5730e9dbb7ab156bd5675787e18e926cd5434b20ebe8baf9","categories":[{"id":"food-and-cooking","label":"Food & Cooking"},{"id":"home-and-everyday-objects","label":"Home & Everyday Objects"},{"id":"friendship-and-social-life","label":"Friendship & Social Life"},{"id":"time-and-memory","label":"Time & Memory"},{"id":"language-and-communication","label":"Language & Communication"},{"id":"nature-and-outdoors","label":"Nature & Outdoors"},{"id":"animals-and-pets","label":"Animals & Pets"},{"id":"travel-and-transport","label":"Travel & Transport"},{"id":"cities-and-public-spaces","label":"Cities & Public Spaces"},{"id":"art-and-creativity","label":"Art & Creativity"},{"id":"games-and-play","label":"Games & Play"},{"id":"work-and-meetings","label":"Work & Meetings"},{"id":"technology-and-screens","label":"Technology & Screens"},{"id":"diy-and-making","label":"DIY & Making"},{"id":"shops-and-services","label":"Shops & Services"},{"id":"sleep-and-dreams","label":"Sleep & Dreams"},{"id":"space-and-big-questions","label":"Space & Big Questions"},{"id":"music-and-sound","label":"Music & Sound"},{"id":"clothing-and-personal-style","label":"Clothing & Personal Style"},{"id":"small-experiments","label":"Small Experiments"},{"id":"learning-and-skills","label":"Learning & Skills"},{"id":"perception-and-what-ifs","label":"Perception & What-Ifs"}],"ideas":[{"id":"BONG-0001","categoryId":"food-and-cooking","text":"A pizza box needs a corner full of extra toppings. Halfway through, you could change your mind about what pizza you ordered."},{"id":"BONG-0002","categoryId":"home-and-everyday-objects","text":"A shelf that folds out of the door when you arrive carrying too much. How many shelves are currently on the wrong side of the problem?"},{"id":"BONG-0003","categoryId":"friendship-and-social-life","text":"A party needs a little departures board so 'leaving in five minutes' can be updated honestly without making another announcement."},{"id":"BONG-0004","categoryId":"time-and-memory","text":"What if you could save unused hours from a boring day and spend them on a good one? I'd waste a whole Wednesday for another hour at the beach."},{"id":"BONG-0005","categoryId":"language-and-communication","text":"There should be punctuation for 'I know how this sounds, but please let me finish.'"},{"id":"BONG-0006","categoryId":"nature-and-outdoors","text":"Put a bench in front of a completely ordinary wall and call it a viewpoint. How long before someone sits down to see what they're missing?"},{"id":"BONG-0007","categoryId":"animals-and-pets","text":"My dog watches me put clothes in a suitcase and knows something's wrong. He's worked out packing without ever needing to pack."},{"id":"BONG-0008","categoryId":"travel-and-transport","text":"A train ticket should suggest one thing to look for out the window. Not a landmark. A tiny side quest for the journey."},{"id":"BONG-0009","categoryId":"cities-and-public-spaces","text":"A town square with one enormous dining table instead of separate benches. Passing the salt could become a way of meeting someone."},{"id":"BONG-0010","categoryId":"art-and-creativity","text":"Paint something specifically to be seen through a half-open door from the next room. Would it look wrong if you stood right in front of it?"},{"id":"BONG-0011","categoryId":"games-and-play","text":"Chess, but you have to persuade the pieces to move. You can see the winning move. Unfortunately, the horse doesn't like you."},{"id":"BONG-0012","categoryId":"work-and-meetings","text":"Every meeting should have an empty chair labeled 'the person who has to do the thing we are casually suggesting.'"},{"id":"BONG-0013","categoryId":"technology-and-screens","text":"Browser tabs should get further apart the less they have to do with each other. I want to see the actual distance between my work and the soup recipe."},{"id":"BONG-0014","categoryId":"diy-and-making","text":"Make a lampshade from paper windows around a cool LED light. Switch it on and the room looks like a neighborhood after dark."},{"id":"BONG-0015","categoryId":"shops-and-services","text":"A shop that sells the one bit that broke. Not the whole replacement thing. Just the lid, the clip, the weird plastic corner."},{"id":"BONG-0016","categoryId":"sleep-and-dreams","text":"An alarm that plays your own explanation of why you wanted to get up early. Let's see whether last night's argument holds up."},{"id":"BONG-0017","categoryId":"space-and-big-questions","text":"If aliens judged Earth by what we put in protective cases, would they think phones are the pets and we carry them around?"},{"id":"BONG-0018","categoryId":"music-and-sound","text":"A doorbell that starts a song when you press it and stops when the door opens. You'd find out who's taking their time by how far you get."},{"id":"BONG-0019","categoryId":"clothing-and-personal-style","text":"Clothes shops should show photos of people sitting down in the clothes. That's what most of us are buying them to do."},{"id":"BONG-0020","categoryId":"small-experiments","text":"Give someone an unfamiliar kitchen gadget and ask them to demonstrate what they think it does before telling them. Their version might be better."},{"id":"BONG-0021","categoryId":"food-and-cooking","text":"Soup needs a shoreline. Give me a bowl with a little bread beach so I can decide exactly how wet each bite gets."},{"id":"BONG-0022","categoryId":"home-and-everyday-objects","text":"A sofa should come with a map of its internal geography. I've lost enough coins in there to justify naming the regions."},{"id":"BONG-0023","categoryId":"friendship-and-social-life","text":"Friends should come with instructions. Mine would start with 'not talking doesn't mean I'm upset.'"},{"id":"BONG-0024","categoryId":"time-and-memory","text":"Write tomorrow's diary entry tonight. Then see which parts of the day you actually managed to predict."},{"id":"BONG-0025","categoryId":"language-and-communication","text":"How many words started because someone misheard something and neither person checked?"},{"id":"BONG-0026","categoryId":"nature-and-outdoors","text":"What if we named clouds collectively while they passed overhead? Two streets over, the same cloud could already have a completely different reputation."},{"id":"BONG-0027","categoryId":"animals-and-pets","text":"A cat tree built around the one actual tree visible from the window. Would the cat notice its indoor version is missing some branches?"},{"id":"BONG-0028","categoryId":"travel-and-transport","text":"A bus with a 'happy to chat' section. Everyone else gets to stare out the window without wondering if they're being rude."},{"id":"BONG-0029","categoryId":"cities-and-public-spaces","text":"What if buildings wore temporary name tags for their previous uses? 'Hi, I used to be a cinema' would explain some very dramatic pharmacies."},{"id":"BONG-0030","categoryId":"art-and-creativity","text":"An exhibition of empty display stands. Could you guess what used to sit on each one just from the shape of the support?"},{"id":"BONG-0031","categoryId":"games-and-play","text":"A board game where the winner secretly has to do the dishes. Only one player knows this, and they're losing very convincingly."},{"id":"BONG-0032","categoryId":"work-and-meetings","text":"A printer with a preview slot that shows one strip of the page before using a whole sheet. Let me stop it when the first letter is already enormous."},{"id":"BONG-0033","categoryId":"technology-and-screens","text":"When you delete a file, it moves into a village with all your other deleted files. I'd keep checking on the essay I abandoned in 2014."},{"id":"BONG-0034","categoryId":"diy-and-making","text":"Make a cardboard version of your room so you can try moving the furniture without moving the furniture."},{"id":"BONG-0035","categoryId":"shops-and-services","text":"A bakery that sells dough at every stage. Pick it up before work, after work, or already baked, depending on how ambitious you're still feeling."},{"id":"BONG-0036","categoryId":"sleep-and-dreams","text":"What if dreams came with end credits? I'd like to know who cast my old maths teacher as the captain of a supermarket."},{"id":"BONG-0037","categoryId":"space-and-big-questions","text":"Space travel would be less lonely with a screen showing the view from your old kitchen window. I'd cross the galaxy and still check if it's raining at home."},{"id":"BONG-0038","categoryId":"music-and-sound","text":"Record the sound of every drawer in your kitchen and make a drum kit. Finally find out whether the cutlery drawer has been carrying the band."},{"id":"BONG-0039","categoryId":"clothing-and-personal-style","text":"A jacket with a pocket that can only be reached while you're wearing it inside out. Perfect place for something you shouldn't impulse-buy anything with."},{"id":"BONG-0040","categoryId":"small-experiments","text":"Sort your possessions by how far they traveled to get to you. Which thing on your shelf has had the most interesting life?"},{"id":"BONG-0041","categoryId":"food-and-cooking","text":"What if restaurant menus had a page for the meal you imagined on the way there? You describe it badly and the kitchen negotiates."},{"id":"BONG-0042","categoryId":"home-and-everyday-objects","text":"Put a visit counter on every door in the house. I want to see which room I keep entering for absolutely no reason."},{"id":"BONG-0043","categoryId":"friendship-and-social-life","text":"At dinner, everyone tells a true story but stops halfway. The table guesses the ending before hearing what actually happened."},{"id":"BONG-0044","categoryId":"time-and-memory","text":"What if photographs captured what you were about to say? Half my family album would be called 'wait, not yet.'"},{"id":"BONG-0045","categoryId":"language-and-communication","text":"Stare at a word until it stops looking like a word. Then try to invent a better spelling before the original starts ma